RATE,TITLE,CONTENT
3,El defecto de diseño está en  botón de encendido.,"Los 1000L que tiene son reales (tengo varias linternas de baja gama y alta propaganda, dicen tener 4mil  y 2mil lumenes,  pero alumbran un tercio de lo que alumbra ésta Fenix. Tambien tengo una que dice tener 10 mil L. pero alumbra como esta Fenix nada mas. El modo estrobo es increíble no es solamente cegador sino alucinógeno  (prueben mirar un minuto una pared blanca alumbrandola con el  modo estroboscópico, el ojo empieza a tener alucinaciones) pero no miren directamente el foco de la linterna realmente puede matar las células fotosensibles  si la acercan demasiado a los ojos. Nunca la dejen al alcance de un niño.  Este modelo  a pesar de tener un led de alta eficiencia consume mucha batería  en máximo, por la enorme potencia que tiene. Afortunadamente se puede regular desde 9 lúmenes hasta los 1000.  El punto negativo a tener en cuenta es el botón de encendido, es doble y lo tiene al ras de la carcasa y en una situación donde estas en la oscuridad y necesitas encenderla rápidamente, se complica, no es tan fácil encontrar el botón y al ser doble seguro que le das a otra función, luego tenes que cambiarla de nuevo lo cual hace perder tiempo valioso en una situación X por Ej. estas pescando escuchas algo q se acerca agarras la linterna y tenes q ponerte a buscar el P...botón de encendido.  Este problema hace que esta linterna no sea táctica como dicen, sino de camping, senderismo etc.  Para mi no es 5 estrellas y tampoco táctica debido a este gran problema."
3,Bueno,"Buen producto, aunque sería deseable que el vendedor publicara y advirtiera en la propia publicación con letras grandes, sobre las recomendaciones de SEGURIDAD PARA SU USO y su posible peligrosidad frente a un uso inadecuado. Por ser un ácido, es necesario neutralizarlo antes de desecharlo (no se explica eso, ni como hacerlo). El contacto con metales como el hierro produce una excelente desoxidación, pero a su vez, durante ese proceso libera a la atmósfera hidrógeno, que en un ambiente cerrado es altamente inflamable (incluso puede ser explosivo), y que no se huele ni se ve (no se menciona). La capa de fósforo que queda en el metal no es suficiente protector anticorrosivo para el futuro dado que es fina y débil (se dice lo opuesto). En el video de la publicación no se usan guantes para manipular el producto. Yo estoy conforme con mi compra y lo adquirí sabiendo sus precauciones, pero estoy desconforme con la publicación, que omite proteger al comprador inadvertido y solo muestra las virtudes. Considero que un buen vendedor debe hacer prevalecer estos aspectos por sobre la venta como una prioridad absoluta y obligatoria."
3,"Conforme. era lo que esperaba, ni mas ni menos.","En Contra: La calidad del plastico y terminación en especial donde se enchufa el toma corriente y las entradas HDMI, USB, TV, a/v, etc. El enfoque es a rosca y no se mueve perfectamente(juego) lo que hace bastante dificil encontrar el punto exacto que mas claro se ve, la imagen en el centro es muy buena y va perdiendo calidad hacia todos los bordes. 

A Favor: En corta distancia provee una buena pantalla, a menos de dos metros te posibilita una pantalla de buenas proporciones y se nota la diferencia contra un LED de 43 que venia usando. Es muy facil de usar, la pc con una placa de video gama media mediante HDMI funciona perfecto, las peliculas se ven bien con total oscuridad y se visualiza el navegador perfecto con una luz prendida en el cuarto. El sonido que provee es suficiente, pero es necesario un home theater para logar calidad. El sintonizador de tv al principio es dificil de usar, pero da muchas posibilidades de configuracion, funciona bien. El sonido del cooler es aceptable.

Conforme, es un producto bueno por 1/3 del valor de un producto de marca premium y la mitad de un tv que ofrece muchas menos pulgadas de pantalla, si tuviera una mejor terminación en los ajustes mecanicos del enfoque le daria 5 estrellas."
3,Buena calidad pero no serviría para mi propósito.,"El silbato es de buena calidad -tal como se lo ve en la foto- pero yo suponía (en base a su descripción y al conocimiento popular) que sería inaudible para los humanos y sumamente atrayente o molesto para los perros (e incluso gatos), pero para mi decepción se escucha mucho (lo cual parecería molesto para su uso urbano) y apenas si les llamó la atención la primera vez (como cualquier sonido nuevo) para rara vez más prestarle atención.
El ajuste a rosca pareciera que no cambia nada y además se siente como que el chiflido tiene poca intensidad (apenas si se oye a media cuadra de distancia).
Sé que la inversión es muy poca pero dificulto que le vaya a encontrar la utilidad con mi símil Jack Russell Terrier (ya bastante bien adiestrado con órdenes vocales o gestuales a corta distancia).
El manualcito que viene en el blister da las pautas básicas de entrenamiento  para controlar el perro a distancia pero sobreentiende que al perro le llamará la atención y que el volúmen del chiflido sería el suficiente."
3,"Ayuda, pero no es imprescindible","Como es la primera máscara fotosensible que tengo, voy a hablar en general porque no puedo compararla con otras. Lo primero que se nota es que es más pesada que las máscaras convencionales, aunque con el tiempo es un detalle que no importa. Lo que no me gustó para nada es que en estado de reposo, el cristal está claro o sea que si estás apurado y no prestás atención, te podés quemar los ojos si la máscara no funciona por ejemplo si las pilas están agotadas. Yo por las dudas, antes de usarla la pruebo con un ""magiclick"". Noté que la primera vez que la pruebo en el día, no funciona, empieza a andar en la segunda o tercera vez que le chispeo el magiclick, así que ¡cuidado con eso! Después de eso funciona bien hasta que se deja de usar unas horas en donde se repite el ""problema"". Aconsejo tener a mano la máscara convencional porque si no funciona y uno está apurado no hay tiempo de desarmarla y encontrar el problema. ( a mi me pasó y lo solucioné sacando y volviendo a colocar las pilas) Elegí esta máscara porque creo que tiene un precio accesible (redondeando $1500, hay otras muchísimo más caras alrededor de $20.000 y otras más económicas alrededor de $500. Creo que es importante para la vista la reacción de 1/20.000 seg (cuanto menor el tiempo de reacción, mejor)Las mas económicas tienen un tiempo de reacción de 1/10.000 seg.En esta, podemos regular la sensibilidad y el tiempo que tarda de oscuro a claro.En estado claro, se ve bien (no excelente porque tiene una tonalidad)."
3,Regular,"Muy buen estado de los juegos, puntualidad buena (llegaron 30 min antes de comenzar el cumple), Finalizando el cumpleaños se largo a llover con viento y logramos cerrar el inflable q se llego a mojar un poco (nada q con un trapo seco o un rato de sol no pueda secarse) el motor no se mojó ni una sola gota y todo se puso al resguardo y bajo techo. Al llegar a buscarlos la sra hizo un escandalo a los gritos en mi casa y faltando el respeto de tal modo q  genero un mal momento y empaño el servicio q hasta el momento habia sido MB. Se les abono la mitad de la dif. q segun ellos les cobran para lavar y secar x completo el inflabe (medida 2x2 aprox). No entregan recibo ni factura como comprobante de lo abonado. Los juegos se devolvieron en perfecto estado como fueron alquilados, nada se rompió ni se maltrató. El muchacho siempre con buena predisposición. La calidad de los juegos es para recomendar, pero ante una eventualidad en vez de conciliar, conversar o explicar con el cliente hacen todo lo contrario y eso es lo q finalmente a uno como contratante le termina quedando una mala experiencia."
3,El fabricante no promociona este producto...,"Muy buena calidad de audio pero con excesivo realce de bajas frecuencias que no se puede compensar salvo que se utilize un ecualizador en el celular o dispositivo de reproducción. Tiene un micrófono de muy buena calidad incorporado, pero no trae con un cable de con ficha 3.5 mm que permita hacer uso del micrófono. El cable que trae es sólo para escuchar o compartir audio. O sea, no se puede usar el micrófono a través del cable provisto (hay que conseguirse un cable). Correcto funcionamiento del bluetooh. El conjunto es muuuy pesado lo que hace con un leve sacudon de la cabeza este se desacomode o se caiga. Además puede resultar cansador, ya que no pasa desapercibido semejante bodoque en la cabeza. Buenos acolchados, pero muy calurosos pues apoyan fuertemente contra los pabellones auditivos (orejas). Para el peso del producto, las orejeras deberían haber sido más grandes, de modo que rodeen las orejas por fuera. El producto no figura en el catálogo online de la marca Bluedio, lo que es todo un síntoma, pero en algun momento lo tuvieron online pues si buscas en manual lo encuentras entre los manuales que tienen para descargar. Es decir, el fabricante no promociona este producto. ¿Acaso no tuvo buena acogida entre los audiófilos?."
3,Buena...,"El producto funciona bárbaro si estás al aire libre, si vivís en el campo o en las afueras de la ciudad. Si vivís en plena ciudad, no te funciona, porque hace interferencias con las antenas de celulares y demás. Si hay paredes también se dificulta la transmisión, y se corta si te vas trasladando con el transmisor en la mano. La cámara nocturna funciona bárbaro, lo tenés que tener relativamente cerca del chico, para que se pueda ver. La batería del monitor no dura mucho, tenes que tenerlo enchufado a los 20 minutos aprox. de haberlo encendido, porque se te apaga automáticamente -no tenés ningún indicador sonoro de que se te va a apagar, más que una lucecita roja que indica 'baja batería'-. 
Respecto al sonido, si no tenes interferencias, lo podés poner y se escucha bárbaro. El tema es cuando hay interferencia, se empieza a escuchar ese ruido molesto que aparece cuando no hay señal en la radio o en la tele, por lo que tenés que bajarlo y ponerlo en silencio.
Lo que está muy bueno es el conector al tele. El problema es que es muy cortito el cable y si tenés el tele amurado en la pared (como yo), tenés que dejar el aparato prácticamente colgado (y que justo en ese lugar no haga interferencia). Otra contra es que si estás en un lugar que no tenés un enchufe cerca, o no hay luz, no lo podés usar, ya que la cámara tiene que estar permanentemente enchufada para que transmita. 
Las cosas buenas: tiene muy buena resolución y sonido."
3,Bien pero eemmm...,"todavia no pude pobrar el producto por que me guie por la imagene de mercado libre y no me di cuenta que no venia con sistema operativo , tuve que hacer un gasto aparte para poder ponerle un sistema operativo , otras cosas de las qe di por hecho que venia y no vino fue lectora de CD , es normal qe muchas de las compus modernas vengan sin lectora pero bueno hay todavia productos qe su intalacion viene con CD ,  otra cosa fue que me guie mucho por la foto de mercado libre el gabinete es una locura el de la foto bueno yo me encontre con un gabinete comun y corriente qe no es nada parecido a una pc gamer  y por ultimo venian supuestamente de regalo un teclado, un mousse y unos parlantes la verdad que los parlantes de muy mala calidad osea safan si no tenes otros parlantes pero no sirven mucho ...
NO TUVE PROBLEMAS EN LA ENTREGA FUE ENTREGADO EN EL HORARIO PACTADO Y DE MUY BUENA MANERA ENTREGADO 
NO PUEDO CRITICAR LA ATENCION DEL VENDEDOR POR QE NO TUVE TRATO DIRECTAMENTE CON EL SOLO POR MENSAJES DONDE ME DECIAN QE TENIA QE HACER SI PASABA ALGO CON LA COMPRA REALIZADA. 

Espero que le sirva la critica"
3,Bueno,Buen producto. Recomendable.--------------------------------------------------------------------------------------------------------------------------------------------------------------------------------------------------------------------------------------------------------------------------------------------------------------------------------------------------------------------------------------------------------------------------------------------------------------------------------------------------------------------------------------------------------------------------------------------------------------------------------------------------------------------------------------------------------------------------------------------------------------------------------------------------------------------------------------------------------------------------------------------------------------------------------------------------------------------1-----------------------------------------------------------------------------------------------------------------------------------------------------------------------------------------------------------------------------------------------------
3,Muchos problemas de compatibilidad.,"Es muy práctico cambiar de PC presionando dos veces el Bloq Despl (Scroll lock) seguido de las teclas de arriba o abajo. Sin embargo me encontré con que tiene MUCHOS problemas de compatibilidad. Probé 3 mouse Genius distintos y dos teclados. También tuve que probar con dos cables HDMI distintos porque uno no lo detectaba.
Solamente el mouse Genius más básico funcionó, y sólo el teclado más económico Genius funcionó bien. No funciona con el mouse Genius g600, ni con el teclado genius scorpion k20. Tampoco me funcionó con un mouse genérico Genius nuevo y tuve que usar un mouse genérico de los más viejos que tenía en casa. Es un producto que cumple con su función una vez que se conectan los dispositivos que (de casualidad) son compatibles, pero realmente da muchos dolores de cabeza hasta que uno encuentra una combinación que funciona bien. Por algo los otros KVM HDMI salen muchísimo más caros.
Evidentemente este producto de Kanji es de calidad muy pobre y de prestaciones muy reducidas. Le doy tres estrellas y lo categorizo como ""Bueno"" principalmente porque el precio es el más bajo que se puede conseguir para un KVM HDMI, pero con los problemas de compatibilidad que tiene no lo compraría nuevamente, y quizás buscaría comprar uno más caro, con alimentación externa para que pueda soportar mouse y teclados con leds y funciones extra."
3,Costo muy alto para lo que ofrece,"La calidad de impresión no es tan buena, las imágenes se impimen mas claras de lo que se muestra en la pantalla.

Imprime bastante rápido, aunque el escaner resulta lento si vas a escanear mas de 10 páginas, ya que el escaner tarda mas tiempo en estar disponible (supongo que se calienta).

Otro detalle a remarcar es que a ese precio, otras impresoras de la competencia ya traen impresión a doble cara automática.

El ahorro en tinta es evidente, aunque en mi caso todavía no se amortiza pagar 4 mil pesos mas que una impresora a cartucho, ya que con esa plata podría comprarme varios repuestos. La idea es llegar a un volumen de impresión que justifique el dinero gastado. Brother tiene una impresora de sistema continuo que esta un 35% mas económica.

Esta buenísima la idea de google coul print, de hecho, es ese el principal motivo por el que me compré la impresora. Pero en la práctica me di cuenta de que imprimo muchos documentos a doble cara, y estoy poco tiempo en mi casa. Y si no estoy en mi casa y mando a imprimir un documento, cuando llego tengo que dar vuelta el documento impreso para imprimir en la otra cara.

En conclusión: es un buen producto, aunque pienso que por el precio, debería tener mas funcionalidades"
3,"Por el precio lo vale, buena calidad","-El reloj es atractivo a la vista, es robusto al ser un smartwatch.  -Las funciones que trae como reloj inteligente no son las mejores, se podrían mejorar.  -Las llamadas y mensajes tienen un delay de 1 minuto casi hasta que suena el reloj.   -A whatsapp no lo pude conectar, nunca me notifico un mensaje de esta app como dice en la publicación y la caja.  - Lo que me gusto son los números grandes y siempre visible, no importa que el sol le de y se refleje siempre resaltan el display del reloj  -Al principio cuesta acostumbrarse al tamaño pero luego se hace muy cómodo.  -Esta bueno que no siempre tenga que estar conectado al telefono, eso si, si no esta conectado no recibiras notificaciones. Ayuda mucho el que se puede prender y apagar el bluetooth.  -El material de reloj es bastante resistente y por mas que sufrio varios golpes no le dejo ninguna marca.  ----EN RESUMEN-----  Si queres un reloj economico con numeros grandes y alguna que otra opciones mas, no te vas a arrepentir. Ahora si queres un reloj inteligente que puedas controlar el telefono y demas, este no es tu producto."
3,"Excelente precio/calidad, pero tiene sus cosas","La relación precio calidad es lo mejor.  Lo bueno:  -Batería aceptable  -Sus 2gb de ram hace que sea muy ligera y performante.  -La carcasa de la tablet es muy resistente, la parte de atrás es un simil metal.  -Está bien hecha, es un producto bien logrado, en cuanto a la arquitectura superó mis expectativas.    Lo malo:  -Se queda un poco corta en cuanto a resolución de pantalla. Por ejemplo al buscar algo en google, las búsquedas aparecen un poco nubladas. Es decir, la definición por momentos o en algunos sitios no es la mejor.  -Cámaras pobres: no las uso y no compre la tablet para sacar fotos, le doy otro uso. Pero quizás sea importante para otra persona.    Un comentario extra, no se para quien sea bueno o malo: la pantalla NO es 10.1, es a penas mas chica. Una tablet de esa medida tiene un poco mas de 250 mm x 150 mm, y buscando un vidrio templado me di cuenta que la tablet es de 240 mm x 170 mm, es decir que es algo así como 9.8 (no le iba ningun cristal templado de 10).    Cumple."
3,Bueno,"Bueno. 
Si me obligan a escribir cuando mi opinión es corta, pero quieren una larga, aca la tienen. 
Si me obligan a escribir cuando mi opinión es corta, pero quieren una larga, aca la tienen
Si me obligan a escribir cuando mi opinión es corta, pero quieren una larga, aca la tienen
Si me obligan a escribir cuando mi opinión es corta, pero quieren una larga, aca la tienen
Si me obligan a escribir cuando mi opinión es corta, pero quieren una larga, aca la tienen.
Si me obligan a escribir cuando mi opinión es corta, pero quieren una larga, aca la tienen.
Si me obligan a escribir cuando mi opinión es corta, pero quieren una larga, aca la tienen.
Si me obligan a escribir cuando mi opinión es corta, pero quieren una larga, aca la tienen.
Si me obligan a escribir cuando mi opinión es corta, pero quieren una larga, aca la tienen.
Si me obligan a escribir cuando mi opinión es corta, pero quieren una larga, aca la tienen.
Si me obligan a escribir cuando mi opinión es corta, pero quieren una larga, aca la tienen.
Si me obligan a escribir cuando mi opinión es corta, pero quieren una larga, aca la tienen
Si me obligan a escribir cuando mi opinión es corta, pero quieren una larga, aca la tienen
"
3,buen producto gracias,"todo bien lo que no funciona las baterias ya las repuse anda perfecto
conforme con la compra gracias................................................................................................................................................................................................................................................................................................................................................................................................................................................................................................................................................................................................................................................................................................................................................................................................................................................................................................................................................................................................................................................................................................"
3,NO RECIBI LO QUE PEDI,"BUENAS TARDES: 
                            QUERIA DECIRLES QUE: LA COMPRA FUE POR UNA ASUS MODELO X556UQ (VIVOBOOK), QUE EL PRECIO ORIGINAL RONDABA ALREDEDOR DE $ 24.000 O $ 25.000, Y ESTABA DE PROMOCIÓN EN $ 18.998 Y EN DETALLE DE LA COMPRA, QUE ME MANDARON POR MAIL DECIA: ASUS INTEL I7 7MA 8 GGB DDR4 1TB NVIDIA 2GB WIN 10. CUANDO LA RECIBI, LA ENCENDI SIN DARME CUENTA QUE COMENZARIA A INSTALARSE. MIENTRAS SE INSTALABA COMENCÉ A  MIRAR LAS ETIQUETAS EN LA NOTEBOOK Y ES UNA ASUS MODELO X556U, BUSQUE  EL PRECIO ORIGINAL DE LA MISMA Y RONDA ALREDEDOR DE $22.000. SINCERAMENTE NO RECLAME ANTES PORQUE COMO TUVE QUE PONER MI CORREO Y CLAVE, ETC. PIENSO QUE YA ESTA, YA ME CLAVE. PERO A ESE PROVEEDOR NO LE COMPRO MAS, PORQUE NO ME MANDO LO QUE YO QUERIA. AHORA QUE UDS. ME PREGUNTAN SIENTO QUE TENGO LA OPORTUNIDAD DE HACER EL RECLAMO O DECIR LO QUE PASO.
                           GRACIAS POR DARME LA OPORTUNIDAD DE HACER EL COMENTARIO.
                            LOS SALUDO ATTE.
                                                MONICA C. DIAZ   

"
3,No es super bueno pero tampoco tan malo,"El vendedor, bien. Primera experiencia con OCASA, bien entrega a 7días de la compra 7días antes de lo estimado. Respecto al producto, funciona bien. Los problemas de sincronización se solucionan con Smart Wear (no con BT notifier que recomienda bajar el reloj), la batería no dura nada si está conectado al cel por lo menos dura 4-6 horas. El sistema operativo muy básico pero veloz, las letras parecen las de un nokia 1110 pero coloreadas verde, el touch screen bien. Cómodo elegante y bastante ergonómico. En la imagen se ven gráficos que el reloj no posee así que no se guien por eso. Tiene funciones de podómetro, recordatorio de ejercicio y algo como un contador de horas de sueño, aunque no se pueden activar más de una al mismo tiempo. La marca la desconozco porque ni el empaque ni el manual decían nada, solo Y1 en el nombre del aparato según el bluetooth de mi teléfono. El manual viene en chino y en inglés solamente así que cuidado aunque el aparato sí puede configurarse en español. Transmite buena calidad de audio entre cel y reloj y las llamadas se oyen como si las hiciera desde el teléfono. Los tonos que tiene son insoportablemente monofónicos así que recomiendo poner una SD con alguno bueno o dejarlo en vibrador. El slot para sim no lo probé, me parece inutil pero ahí está. En resumen, bueno para fogonearse con esta tecnología pero no para andar todo el día en la calle con esto porque se te acaba al toque la batería, más para conectarlo en casa mientras el cel se carga."
3,SOLO UN BUEN CASCO.....,"No siempre lo mas caro es lo mejor,es buen casco,solo un buen casco!!. Para lo que lo cobran deberia tener mas detalles de terminacion,funcionalidad y resistencia. Los materiales parecen buenos. Es liviano y con buen calce. Se ve todo muy fragil,los anclajes del interior y la rueda de ajuste fino por ejemplo. Las tapas de ventilacion son incomodas de llevar una vez sacadas,deberian ser mas chicas y poder caber comodamente en un bolsillo. No tiene lugar para colocar el soporte de la camara deportiva,de colocarlo sobre la tapa se desprenderia todo. La vicera deberia ser un poco mas larga para que cumpla su funcion adecuadamente. La luz trasera tiene buen rendimiento. El interior textil de invierno trajo una costura zafada pero parece ser muy util. Lo del codigo qr es una buena idea. El lugar para colocar los lentes esta logrado pero solo entran ciertos tipos de patillas. Lo mas destacable es la bolsa de transporte (lamentablemente). De haberlo tenido en mano antes de comprarlo hubiera optado por otra marca/modelo."
3,Única Opción para usar Kinect en Xbox One S...,"El producto es lo que dice ser, un cable fuente y conector USB para poder usar el kinect en la Xbox One S o en la PC. Va a 220v no necesita más adaptadores, la verdad, un pifie de Microsoft que obliga a los que teníamos Kinect en la Xbox One a comprar esto para la nueva consola S que de por sí no cambia radicalmente en software/hardware. El precio por lo que contiene, es excesivo, realmente no vale lo que cuesta, mucha caja y poco contenido (dos cables, un bifurcador de datos/energía y una fuente), pero de origen ya es caro (unos U$ 45), sumando gastos de envío, aduana y comisiones de Mercado Libre, lamentablemente no es posible conseguirlo mucho más barato. Para aquellos que disfrutan del Kinect con la familia y quieren seguir haciéndolo con su nueva consola o en su PC, es la única opción. Hubiese sido genial que venga en el bundle de la Xbox One S, o de las nuevas Kinect, pero han dejado de apostar a ese accesorio que tanto prometió a futuro en su lanzamiento y hoy está prácticamente abandonado. Una picardía que tengamos que gastar casi lo mismo que el propio Kinect, en un simple cable."
