RATE,TITLE,CONTENT
3,Bueno,"Estoy empezando con este octapad, muy entretenido, suena bien, con auriculares se disfrutan mas. Los platillos al principio me gustaba como sonaban pero cada vez me parecen menos reales o.O . Los pedales son malos y no tiene sesibilidad, cambiar el del bombo que con el que te viene es desesperante. Se puede customizar todos los pads y modificar el volumen en conjunto o por separado.   Tiene algunos canciones de muestra pero aun no encuentro para tocar sobre una base sin bateria ya que me parece molesto y son muy complejas las canciones que hay.   Como no tengo mucho espacio esta bateria me viene barbaro, el tema está en donde apoyarlo, yo uso sobre una caja de un gabinete pc gamer para que me quede bien a la altura de las rodillas (si, asi de croto soy).   Lo compre pensando en el tamaño, sesibilidad, y el uso que le podria dar.   Ahora que me enganche con este tema de la bateria pienso que me quedé algo corto con este producto, por esto en este momento estoy pensando en algo mas grande."
3,"Bien, pero mas o menos.","Es una bici un poco mejor que las de cuadro fijo mas baratas, tiene mejor estetica y es algo mas comoda. Es barata, no esperen una maravilla. Está hecha enteramente con materiales de segunda. No hay ninguna pieza de calidad reconocida en la misma. La verdad que la uso con alguna frecuencia y en 3 meses se me destartalaron muchas cosas. El asiento se rompió y quedó como un flan, la cadena se me cortó cuando estaba pedaleando en una junta de calles muy peligrosa, y las ruedas no son muy buenas. De a poco estoy cambiandole las piezas berretas por otras de primera marca. Yo recomendaría mas que esta bici, directamente comprarse una mtb de al menos 10 lucas con componentes shimano que es sinonimo de durabilidad.   La verdad si la van a usar muy poco está bien, pero si la quieren como medio de transporte, probablemente de vez en cuando sufran alguna hinchazón de pelotas por parte de la susodicha.   Pros: es bastante compacta y relativamente liviana, el cuadro para ciudad es muy comodo. Ya que es bajo y queda bien para cuando uno tiene que parar por ejemplo, en un semaforo.   Para terrenos irregulares la suspensión que tiene ayuda, tampoco es una maravilla, por el precio se sobreentiende.   Como dije antes, si va a usarse con una minima frecuencia te recomiendo gastarte un par de luquitas más y comprar algo de mas calidad.   Hay otras bicis mas buenas por $10. 000 (feb-2019) que hoy habiendo pasado ya por esta, directamente  iría por ellas. La diferencia no es tanta y se justifica."
3,Recomendado para los no exigentes,"Reloop Keyfadr Sabia que compraba algo calidad media, pero vino rajado fallado de fábrica y eso no lo esperaba, la primera vez que me pasa comprando, se pasaron de ajuste en los tornillos y por eso muchos safan (No ajustan) y esa fue la causa de las rajaduras.   El primer potenciómetro del canal 1 (el mas chico) se trababa al girarlo... lo solucione sacando la perilla y agrandando el agujero donde esta el potenciometro con algo filoso.  El modo arpegiador no suena a tiempo con Ableton, por ahi es como que se adelanta, lo comprobe grabando y revisando las notas midis, se sale de tiempo.  Muy poco espacio para girar las perillas, hay que agarrarlas como pellizcando algo.    Igual me resultó muy util y la ubicacion y atajos me parecen comodos, me gusta mucho que estén enumerados los canales y los colores de los botones. Las Teclas son chicas aunque faciles de tocar y me gusto mucho para programar baterias, lineas de bajo o sintes sencillas. Los faders bien.    En Fin muy util e igualmente me gusto mucho y ya me esta ayudando demasiado como herramienta para improvisar y hacer ajustes al vuelo, tamaño ideal, transportable y liviano.  Conectas y usas, se puede mappear a tracktor o Virtual Dj.    Solo creo que deberia valer un poco menos por como vino... Lo Recomiendo igual aunque si dispones de mas dinero anda por algo mas avanzado y de mayor calidad."
3,NO venden lo que dicen. NO ES TODO HONDA,"El motor es honda, pero no aclaran y deberian, que el resto no lo es. Osea,venden un motor honda (creo) con una desmalezadora genérica. La calidad del resto no acompaña, esperemos dure. La foto publicada con el gaurdapasto negro, no es la màquina que venden, el soporte que viene es generico y tiene una abrazadera al caño eje. En la foto se ve que no es asi. La calco honda que tiene puesta, no es la misma de la foto, que tiene el modelo de máquina. El naranja con el que estan pintados el cardán inferior y la toma superior. No tiene nada que ver con un producto honda. Osea, muchachos  para hacerla pasar por honda, deberian ser más prolijos;sino. Aclararlo y listo. Se siente como una estafa, o engaño al menos. No?. En realidad se compra y deberian publicar una desmalezadora genèrica china equipada con un  motor honda gx 35. Resulta que publicitan una desmalezadora honda 35,8cc umk435t. El motor vino con menos del aceite indicado. Osea tuve que agregarle. No habia ningun aviso de completar niveles o si el motor viene sin aceite,podría ser, por el transporte y envìo; es entendible si asi fuera,solo deberian avisar. Deberìa tener una advertencia de completar los niveles. El motor arranco bien y al momento. La probamos un rato y anduvo bien. Confio en el motor, como en todos los productos honda que tengo y tuve a lo largo de los años (sera?). Veremos si el resto esta a la altura  y acompaña,(desde ya el protector plástico de corte no) o si se encuentran repuestos. Lástima."
3,Bueno,nooooooooooooooooooooooooooooooooooooooooooooooooooooooooooooooooooooooooooooooooooooooooooooooooooooooooooooooooooooooooooooooooooooooooooooooooooooooooooooooooooooooooooooooooooooooooooooooooooooooooooooooooooooooooooooooooooooooooooooooooooooooooooooooooooooooooooooooooooooooooooooooooooooooooooooooooooooooooooooooooooooooooooooooooooooooooooooooooooooooooooooooooooooooooooooooooooooooooooooooooooooooooooooooooooooooooooooooooooooooooooooooooooooooooooooooooooooooooooooooooooooooooooooooooooooooooooooooooooooooooooooooooooooooooooooooooooooooooooooooooooooooooooooooooooooooooooooooooooooooooooooooooooooooooooooooooooooooooooooooooooooooooooooooooooooooooooooooooooooooooooooooooooooooooooooooooooooooooooooooooooooooooooooooooooooooooooooooooooooooooooooooooooooooooooooooooooooooooooooooooooooooooooooooooooooooooooooooooooooooooooooooooooooooooooooooooooooooooooooooooooooooooooooooooooooooooooooooooooooooooooooooooooooooooooooooooooooooooooooooooooooooooooooooooooooooooooooooooooooooooooooooooooooooooooooooooooooooooooooooooooooooooooooooooooooooooooooooooooooooooooooooooooooooooooooooooooooooooooooooooooooooooooooooooooooooooooooooooooooooooooooooooooooooooooooooooooooooooooooooooooooooooooooooooooooooooooooooooooooooooooooooooooooooooooooooooooooooooooooooooooooooooooooooooooooooooooooooooooooooooooooooooooooooooooooooooooooooooooooooooooooooooooooooooooooooooooooooooooooooooooooooooooooooooooooooooooooooooooooooooooooooooooooooooooooooooooooooooooooooooooooooooooooooooooo
3,okay (not okay),"Los materiales son buenos, la pintura de la reja parece duradera y dificil de desgastar, el diseño esta bien pensado (por ejemplo las partes de plastico estan todas fabricadas para facilitar la limpieza) la rueda encaja bastante bien y si bien genera cierto ruido no es enloquecedor -aunque tal vez alguien de sueño liviano no pueda dormir con esta cerca- y el pequeño compartimiento en la parte superior es bastante comodo para poder agarrar al pequñin y hacerle mimos, aunque no se me ocurre que alguien lo utilice para transportarlo a algun lugar.  Los puntos negativos son que el bebedero es un poco pequeño por lo que tal vez haya que recargarlo mas seguido, pero son animales minusculos, asi que tampoco es una super molestia y este cuenta con un sistema antigoteo que es muy bueno. Las medidas ideales para el desarrollo perfecto de un hamster en cautiverio son de aproximadamente 75 x 40 x 40cm, si bien esta no cumple con estas medidas e incluso los datos que provee el vendedor son mas inflados que los que en realidad posee la jaula (no se si esto es un error del fabricante o del vendedor pero las medidas reales son de 39 x 27 x 25) nuestra amiguita se la pasa bastante bien.  En lo que respescta a relacion precio/calidad, supongo que me puedo quejar un poco simplemente, sin utilizar mala palabras. xD"
3,Práctico,"Buen taladrito. Un poco decepcionado por la calidad de los plásticos pero por el precio está bien. Supera en poder de perforado a un taladro eléctrico común a cable de 220 volts sin sistema electro neumático. Podría perforar con mayor velocidad pero creo que es porque es de 1,1 joule de fuerza de impacto no le da para apurarse. NO digo que es lento pero al estar acostumbrado a usar un electro neumático a cable, me costó acostumbrarme a esperar un poquito más para perforar con una broca del 10. Perfora hormigón sin mucho esfuerzo y pared de ladrillo al toque. Soy electricista y creo que es ideal para montajes de ménsulas, grampas, etc. Te olvidas de los enredos de cables en altura. Hasta ahora habré perforado unos 100 orificios y no parece agotarse la primer batería.  Buena opción si no te da para comprar un verde, rojo ó amarillo de otras marcas de mayor calidad. Bien por los accesorios que trae y si aguanta un par de años de uso habrá sido una muy buena compra. P. D. No posee función de cincelado y no creo que sirva para hacer durlock porque me parece que no le va a dar para perforar las soleras y el hormigón con fluidez."
3,Copia berreta de un diseño extranjero,"Pase un momento bastante horrible armando esta mesa.    La tornilleria se malisima. Decir que el armatoste negro que une las patas de la mesa esta soldado a ojo es poco. Hay que forzar todos los puntos de union entre el coso negro y las patas para que entre bien.    Los tornillos son malisimos. Estan cortados a mano. No sabes donde va cada uno. Vinieron tuercas de menos. Los tornillos eran demasiado cortos. Lo peor y lo que me hace escribir una reseña tan negra de este producto es que los tornillos son de verdad lo peor que hay en el mercado. Al ser de tan mala calidad, de un metal tan mantecoso, es muy facil redondearles la cabeza y no poder terminar de ajustarlos bien o sacarlos el dia que tenga que hacerlo.    Tuve que salir a comprar tornillos nuevos y que si bien no son tan lindos como los originales, por lo menos son mas duros y no se redondean como si fueran de manteca.    Me indigna que hagan un producto que copia un diseño moderno y vanguardista y no pongan 2 pesos mas en mandarlo con tornilleria de calidad.    Otro detalle es que aparenta ser de MDF laqueado, un material de lo mas economico que con cualquier golpesito se marca y luego no es tan facil de volver a pintar como la madera de verdad.    Dicho todo esto, si tenes la suerte de que te venga con la cantidad correcta de tornillos y tuercas, de entender bien donde va cada tornillo, y de poder armarla sin que se te redondeen la cabeza de los tornillos, y sos cuidadoso, es un hermoso conjunto de comedor."
3,Cumple con lo que se espera de él.,"Es un buen casco que cumple sobradamente con la homologación de resistencia al impacto, aspecto que no todos los cascos reúnen. Por el precio que uno paga, a demás del requisito anterior, debería contar con una mejor goma que permita mayor hermeticidad con el visor externo. En cuanto al visor interno, en mi caso, vino algo descentrado. La hendidura que corresponde a la forma de la nariz está levemente inclinado hacia la derecha, pero no sería su mayor problema. Su defecto radica en que no ofrece mucha resistencia al paso de la luz solar cuando está de frente. Sirve para descansar los ojos, atenuando el brillo.  El casco se empaña, nada fuera de lo normal. La goma que debiera aislar la respiración nasal queda bastante corta, pero no se aleja mucho de un casco ls2, por ejemplo. En lo que respecta a sonoridad, a los 70 km/h se escucha un leve silvido. En cuanto al talle, sólo el primer día lo sentí algo ajustado, pero después del segundo y tercer día, ya sentí que se había amoldado bien. Conclusión: por ser un made in china puede pecar de algunos ajustes correctos en las terminaciones, pero es, en general, un casco de calidad comparado con otros de similar precio y te va a salvar seguro el día que lo necesites. Olvidé mencionar que son de muy buena calidad las almohadillas internas, desmontables. A pesar de los pequeños defectos que tiene, lo recomiendo."
3,"Tres estrellas porque es bueno, pero:","Es bueno. Deja el pelo brillante, pero un poco inflado, en mi opinión.     Soy de tener frizz y rulos y una vez probé uno de GAMA y pensé que este se asimilaría a ese, que no me dejo nada de frizz y el pelo casi lacio y brilloso, pero la verdad es que me equivoqué. No tienen por qué ser iguales, ya que son de diferentes marcas, modelos desiguales y con funciones y modalidades distintas. Sólo que pensé que, por ahí, al parecerse estructuralmente, iban a funcionar igual.   Dentro de todo, es un buen producto, al cuál le doy 3 estrellas porque no cumplió del todo mis expectativas, las cuales eran altas porque lo imaginaba como el aquel otro.     Pienso que, la boquilla de difusor para los rulos es un poco chica, y no me resultó mucho que digamos. Al ser chica, no puedo acomodar bien mi pelo y se hace cualquier cosa frizzada.     El secador en sí, es un poco pesado para tenerlo mucho tiempo en la mano, por lo que si tenés mucha cantidad de pelo se te va a hacer medio complicado. El modelo dice silk, que significa seda, y puede que deje el pelo brilloso, en eso coincido. También, me gusta el hecho de que tenga varias funciones, tales como; 3 intensidades de secado, modo frío/calor, y creo que otra más, si no me equivoco.     Nada más que decir, espero que mi opinión sirva de algo."
3,Bueno,"Es similar a una OREGON, por su práctico sistema de ajuste de la cadena.  La cadena y espada son de buena calidad y originales de OREGON.   El resto parece bueno, con excepción de la palanca del freno de emergencia y su mecanismo que parece endeble.     De hecho me vino con el freno de emergencia  trabado (no lo supe hasta que leí el manual y la armé), y el servicio técnico que figuraba en el folleto ya no atendía la marca OMAHA.  El vendedor se ofreció para revisar la falla si se la llevaba, pero eso era engorroso.   Y entonces probé con unos golpes laterales (con la mano), y haciendo fuerza hacia adelante y se destrabó y arrancó.   La máquina debería venir con una botellita de aceite para cadena, o el vendedor ofrecerla junto con la máquina en un combo, ya que no se debe poner en funcionamiento sin aceite en depósito, que no está cargado porque se derramaría en el transporte.  El manual que viene con la máquina hace referencia a otra distinta en algunos aspectos.   Sería recomendable leer el manual original de una electrosierra OREGON .   Todavía no la probé en la práctica  (salvo encenderla unos segundos para verificar que arrancara),  porque tengo que comprar el aceite especial para cadenas."
3,Para oficina no para pc gamer,"Las tapas son metálicas que fueron pintadas con aerosol, todo lo externo es plástico. La compre para armar un equipo gamer pero la verdad es un asco, tiene una única salida de aire decente, en la parte trasera, donde va el cooler, como en cualquier gabinete de medio pelo. La parte de adelante tiene para colocar cooler, pero la entrada de aire es una entrada miserable, ponerle un cooler adelante es al pedo. En la parte de arriba lo mismo espacio para la salida de aire diminuta, tiene para colocar dos cooler, también al pedo. La distribución de aire es muy mala y para un equipo gamer , realmente es una cagada. A todo esto si le cierras la tapa , levanta demasiado calor. Más en verano. Le tengo que sacar la tapa por que a si no va, la mala distribución de aire caga todo. Se ve bien a simple vista por su precio. Pero la mala distribución de aire la caga y feo, más que todo por que no podes cerrar la tapa de costado por que si no,tenes  un spa ahí adentro. En mi caso lo compre con un cooler y tampoco vino Instalado lo tuve que colocar yo. Sinceramente si van a usar el equipo como gamer, no lo compren vallanse a lo seguro , un sentey, no está tan caro y son buenos. Tiene bien la distribución de aire. Este gabinete está más pensado para un equipo de oficina que queres hacer aparentar que es un maquinon."
3,Esta es la review con la verdad que querés leer.,"Es la entrada de gama en volantes (con force feedback, ya que un volante sin ffb no es más que un joystick redondo) pero el único disponible ""oficialmente"" en argentina. Aún así es uno de los mejores en cuanto a relación calidad-precio. Los pedales son sin duda lo mejor del set, calidad destacable para el precio. El force feedback en sí es mas que mejorable, pero hace su trabajo y es acorde al precio. La caja de cambios si que se ve muy frágil, pero es lo que hay. 
El problema comienza con la fiabilidad. Hasta el día de hoy, no conozco una sola marca de volante - ya sea fanatec, thrustmaster o logitech - que haga un producto del que te puedas fiar en que va a funcionar perfectamente durante un considerable periodo de tiempo desde la compra. El mío a los 6 meses le dejó de funcionar la leva derecha, y ahora los pedales andan un poco locos, lo que lo deja totalmente inutilizable. Cambiarlo gracias a la garantía es una lotería, ya que te envian uno reciclado (otro que tuvo problemas y lo arreglaron), y lo mas seguro es que se rompa de vuelta. 
Ahora me encuentro con un volante en mi habitación que todos los días tengo ganas de usarlo pero no puedo por que no funciona correctamente, y eso es realmente frustante."
3,Es un producto de calidad mediocre.,"Todavía no terminé de instalarlo pero me encontré con varios temas: en primer lugar, si bien la instalación no es complicada, las instrucciones son confusas para una persona que no entiende, yo no tengo problemas porque conozco del tema. Los cables que van dentro del barral no están incluidos, tuve que comprarlos aparte. La tulipa es super-frágil y obviamente llegó destruída, gracias seguramente a los amigos del Correo Argentino, que además dijeron que habían venido y no había nadie, lo cual no es cierto porque es una oficina. La llave de control es cuadrada y no se adapta a la caja de luz embutida estandar que es rectangular, tuve que comprar unas planchuelas para instalarla. La terminación es regular pero si no es para un ambiente refinado zafa. No trae ningún gancho para colgarlo, solo una roldana que hay que sujetar con alambre o algo similar al techo, hasta los ventiladores chinos traen el gancho de sostén, e incluso uno adicional para colgarlo mientras se conecta el cableado. En fin, esperaba más de una marca como Liliana pero es lo que hay. Espero que al menos el motor funcione...Eso sí: es la última vez que pido algo por Correo Argentino, prefiero pagar el envío."
3,Cumple pero difícil de configurar.,"Cumple, pero es díficil de configurar, aun siguiendo las instrucciones al pìe de la letra. La mejor apliación en el la V380S, la ICSee no la usen. La imagen no es gran cosa, pero insisto, cumple, el sonido cuando hablas desde la APP es malo, las alarmas funcionan bien, el mic anda bien. 
Si tenes fibertel vas a tener problemas para conectarlo a tu red y que ande.
 
Copio las instrucciones que yo le pase al vendedor por si se les presenta un caso como el mío:

Si es usuario tiene Fibertel, y el modem Technicolor DPC3848VE lo más probable es que no pueda conectar el foco a la red. El model/router lo detecta, pero como no es un dispositivo confiable no lo deja conectarse. 
Para solucionarlo, luego de seguir TODAS las instrucciones (casi ilegibles) el usuario tiene que entrar en el router 192.168.0.1 (hay que googlear user y pass o llamar a fibertel para que te ayuden) y en la sección de Restricciones de Acceso hay que clickear en Enable en Dispositivos confiables y luego en el listado de dispositivos clickear Yes en la columna de Trusted en la línea del dispositivo. ¿Como saber cual de todos los dispositivos es el foco? Si tenés pocas cosas conectadas es fácil, si tenés muchas tenés que encontrar el Mac y eso lo haces desde la APP V380s.

"
3,"Cumple, por el precio esperaria un poco más....","Cumple su función. Costo un poco que se conecte a arnet (por más que trae preconfiguraciones para paises y operadoras). En modo 5ghz, esperaria un poco más de alcance (teniendo en cuenta la potencia especificada de las antenas). En modo 2,4 ghz, todo perfecto. Trae bastante opciones de configuración, pero por el precio tendria que ser un poco más profunda. El modem/router arkadyan que tenia de arnet permitia crear multiples redes, cada una con su propia configuración y velocidad (así, podiamos hacer una de invitados con velocidad reducida e isolation). Este router solo permite crear una red a 2,4ghz, otra a 5ghz, y una invitada (en ambas frecuencias). No deja limitar la velocidad y las opciones de configuracion qos y trafico son muy limitadas.   Como modem, cumple, pero se esperaria poder cambiar algunas cosas (como pasar de conexión adls atm a ppm -que es mejor-).   Conclusión, como modem y router cumple. Para cosas más completas, varias redes, manejo más profundo del trafico. No va muy bien.   Algo interesante es que permite configurar todo con un app en telefono, incluso desde otro lugar (hay que registrarse en la pagina de tplink, así se inicia sesión con mail y clave remotamente).   Por todo esto, solo 3 estrellas."
3,tuve mala leche,"Hace un ruido molesto de lado derecho al mover la cabeza , no si sera algo suelto adentro o sera el pivote de la orejera ,como tiene sistema de suprecion/aislante de sonido externo , cualquier roce de cables o componentes sueltos interno lo amplifica y resulta molesto , se q no es normal por que del lado izquierdo no hace ningun crujido ni nada parecido , por lo demas funciona todo perfecto , lo uso en la pc sin dramas , solo que si queres usar el mic , para t2 o discord , el sonido sale en mono( usa el perfil hansfree) pero esto es limitacion de bluetooth , no tiene la culpa el producto , si queres sonido estereo y microfono simultaneo wireless   , te recomedaria buscar otra cosa algun heaset q traiga su dongle usb propio(que usan wifi) dado q bluetooth es muy limitado.   Sepan de antemano que el cable jack 3. 5 q trae es de 3 pines solamente , el microfono funciona solo por bluetooth  y al conectar el cable desactiva automaticamente el bluetooth y no hay forma de cambiar esto. Por el tema de la bateria estoy todo el puto dia en la pc y todavia no se me apago , por los 800 mangos q pague a la fecha es muy buen auricular , salvo ese detalle antes mencionado , que mientras te quedes en el molde y tengas musica , no se escucha ese roce ruidito molesto."
3,"Anda pero OJO, no rinde como lo que especifican..","Muy buen kit, aunque yo le agregaría al menos dos o tres filtros extras al mismo ya que con uno solo quedas escaso, ya debo ir a buscar repuesto, me ha durado menos de un mes dandole buen uso diario teniendo en cuenta una pileta con apenas uso, solo de mantenimiento adecuado para la mantencion, los filtros difícilmente durarían 2 meses como dice el vendedor, a menos claro que no se use el filtro mas que dos veces a la semana dos horas. Pero en lineas generales el kit funciona bien para cualquier pileta de lona ""chica"" como lo es en mi caso y OJO con el barre fondo tmb, me desilucione un poco ya que la bomba apenas tiene la succión minima como para levantar con muchísima paciencia, lentamente y despacio polvo y lo que decanta la pile, hablando de una profundidad de 60 cm con 2800 litros, aun así me resulto bien para el uso que le doy y seguro es mucho mejor que cualquier bomba bestway o intex. Si tuviese una pileta mas grande no dudaría dos segundos en comprar un kit con una bomba mas grande."
3,Muy buen producto pero es difícil empalmar placas.,"El producto en sí, es muy bueno. La dificultad que tuve fue en el montaje. Compré placas de 1,22 x 0,61 para revestir una pared completa de un Estudio de Música que hice en mi casa. El problema surgió al momento de colocar las placas ya que si bien todas están cortadas de la misma medida, el corte en todos los lados es en chanfle y por un lugar distinto de la onda. Entonces, es imposible colocarlas tal como están y que den una imagen de revestimiento continuo. Además, como están cortadas siempre por lugares distintos, todas las juntas entre placas quedan distintas, no hay continuidad en las ondas, etc.  Básicamente, lo que tuve que hacer fue rectificar todas las placas. O sea, cortarlas rectas (no en chanfle) y todas por el mismo lugar de la onda. Esto me generó un desperdicio en el material.   Fue un trabajo arduo pero finalmente quedó muy bien. También se complicó al colocarlas porque si bien había rectificado todas las placas, al colocarles el cemento de contacto se expanden levemente. Entonces, hay que ir colocándolas con mucho cuidado para que las ondas de la placa que se está colocando coincidan con lo ya colocado.  Sería muchísimo más fácil y prolijo el montaje si todas las placas estuviese cortadas por el mismo lugar de la onda, pero desconozco si la matricería y máquinas de corte con las que se fabrica este material, lo permiten."
