RATE,TITLE,CONTENT
3,"Muy buena, pero se apaga sola a las 2 horas.","La cafetera es buena. Buenos materiales, hace buen café, parece sólida, y con 1000 watts de potencia hace el café bastante rápido, y lo más importante, CALIENTE, no como otras de menor potencia que lo sacan apenas tibio. 

El único PROBLEMA que tiene y es MUY MOLESTO es el apagado automático. A las 2 horas de estar encendida, se apaga sola. Es INSOPORTABLE, la idea es hacer una jarra y tener café caliente a disposición todo el día, o al menos toda la tarde. Si se pudiera configurar para que al menos espere 4 o 6 horas antes de apagarse, sería perfecta. 

Respecto de este tema consulté a Garbarino (que son los importadores, el manual los referencia a ellos, en esto la marca Coventry es DE ELLOS), y no me dieron ni pelota, y eventualmente me dejaron de responder. 

El otro problema que tiene es que el espacio del filtro es bastante chico, con lo cual si les gusta el café fuerte olvidense de hacer mas de 8 tazas. Soporta preparar hasta 14 pocillos, pero nunca van a poder poner café suficiente para hacer esas cantidad y que no salga demasiado liviano."
3,"Excelente desempeño, baja calidad de material","En un principio me pareció un excelente producto, ya con el paso del tiempo y su respectivo (buen) uso, al querer conectar el mic se desoldo el terminal y se metio adentro del casco derecho, al desarmarlo note que el mismo esta sujeto a la plaqueta con la misma soldadura (no posee anclajes). lo solde lo mejor que pude y a los pocos dias cuando me los coloco en la cabeza y doy el tiron para abajo se me corta el plastico de la vincha del mismo lado que sujeta al parlante derecho y queda colgando solo del cable, lo pegue con Poipol y de momento no tengo mas que quejarme excepto de que subiendo mucho la intensidad de la rueda de vibracion se cola un sonido de interferencia en los parlantes, en ocasiones, repetidas veces se reconecta a la base (si jugas R6S es MUY moleso),me interfiere (sustancialmente) con la conexion de internet wi-fi. En conlcusion: Tiene una excelente calidad de sonido y lo de la vibracion me parece una experiencia genial. El material no es la mejor de la calidad. Si habria sabido esto preferia comprar algo mas costoso al mismo vendedor pero de mejor calidad, gracias."
3,"Tiene detalles, pero la volvería a comprar.","Todo bien, arranca rápidamente, corta perfecto, aunque tiene detalles constructivos. Por ejemplo, la palanca superior que acciona el freno, está prevista para accionar con los dedos de la mano que se ase el soporte superior, pero no puede ser accionada dado que se flexiona sin destrabar el freno, debe ser ayudada con la otra mano tirando desde su parte derecha inferior (minimizando el brazo de palanca). El otro detalle es el acelerador y su traba para el arranque, la traba funciona pero el acelerador no se acciona dado que el juego que tiene el mecanismo absorbe el movimiento no permitiendo que llegue a accionarse. Por este motivo, tuve que dejar fija la regulación del mismo en algunas vueltas más del motor para que arranque fácilmente. No obstante estos comentarios, creo que la relación precio prestación es buena, la volvería a comprar. Veremos la durabilidad del motor y de la cadena, pero no lo sabré hasta que tenga varias horas más de uso, hasta ahora sólo he cortado y trozado un olmo."
3,buena prenda.....,"buena prenda dentro de todo.aunque por la tradicion de la marca,los materiales utilizados y lo que cuesta deberia estar mas pulido el diseño.a favor es muy compacta y liviana para transportar,tiene muy buena impermeabilidad pero...... no tan buena respirabilidad.sabido es que hasta el gore mas tecnico necesita aunque sea una minima corriente de aire interna para evacuar mejor,el pantalon deberia tener una suerte de branquias por ej en la parte interna de la entrepierna al estilo del modelo raptor de la marca pero mas chicas. un bolsillo pequeño le vendria muy bien,mas alla de que sea capa impermeable siempre uno tiene que tener cosas pequeñas a mano.por ultimo un par de refuerzos en la zona de las rodillas utiles para proteger el laminado cuando uno arma o desarma el campamento estarian geniales y lo peor es el sistema de achique de la botamanga,el concepto es bueno pero la presilla deberia quedar (al menos la derecha) del lado externo de la pierna para evitar se enganche con los platos y cadena."
3,"Sencillo, bueno, barato y sin detalles de calidad","El producto es bueno en relacion calidad/precio comparado con otras opciones que hay en el mercado. Cumple su funcion, pero el teclado es un poco ordinario para mi gusto. El material plastico que usaron para hacerlo se nota de baja calidad y se siente de la misma manera. Teclas con largo recorrido en comparacion con un teclado de notebook y la textura y terminacion del teclado parece que fuera de juguete. No tiene absolutamente ningun indicador de luz. Ni para saber si estan activadas las teclas de bloq mayus o bloq num ni para saber si el teclado esta encendido o le falta bateria. El teclado tampoco tiene switch de encendido/apagado. Estimo son los detalles que les permitieron abaratar el costo del producto. El mouse es de buena calidad, comodo y tiene boton de encendido y apagado, aunque tampoco tiene luz, ni siquiera el laser optico propio del mouse. Ambos funcionan muy bien con solo un nano usb receptor, tiene una excelente respuesta. Es una buena opcion para ahorrar dinero, pero no lo recomiendo si se busca un producto con terminacion de alta calidad."
3,"Evaluando costo/beneficio: ""Aceptables""","Sonido ""aceptable"". Tienen mucha coloración. Quien sepa de sonido va a entender a lo que me refiero. Tienen un sonido característico, tirando a lata. Si bien NO suenan como auriculares ordinarios tampoco suenan como los Bosse de iphone. 
Evaluando costo beneficio, están bien. Pero NO pretendan graves. Los graves los  tira en forma de medios.
Particularmente siento que se pierden los planos musicales. Y por ej, coros que estaban grabados en 2dos planos, se pierden con las voces al frente. Lo mismo con los arreglos.
Los compré para batallar en la calle. Pero de venir usando todos los días unos DJS400 de Panasonic, que suenan hermosos. Pasar a éstos es como que me costó. Igual yo buscaba achicar espacio, sabía que no iba a tener nunca la misma calidad un in ear que uno de 30mm.
En cuanto a lo estético son hermosos y re cómodos. El cable es muy finito. Los guardás en un bolsillo sin molestias.

Si buscás algo lindo, cómodo y accesible. Están bien. Si sos enfermito del sonido y/o esperás algo del Pure Bass Sound, andá por otros.
Son mis primeros JBL y pensé que iban a sonar lindo como mis Flip3. Pero pedí demasiado por esa plata. jaja
Espero haber sido de ayuda."
3,Bueno,"El carburador, por ser simil, anda muy bien.
El resorte de la palanca del cebador es muy duro, lo tuve que desarmar y sacarle la traba que mantiene mas cerrada la entrada de aire; sin embargo pedaleo muy poco hasta que arranca bien(para eso mantengo yo con el dedo bajando la palanquita).
Tuve que recortar parte del cubre cable, porque no tiene la longitud justa para que quede sujeto y se pueda usar el acelerador. Estaria bueno que den como opcion un cable a medida.
Las dimensiones que me dijo el vendedor fueron erróneas totalmente.
Desde la salida(la que va a la pipeta y tiene la abrazadera), hasta el filtro de aire (puesto), son 96,3mm y NO 90 !!! Tenia el espacio reducido, si sabia que era de esas dimensiones, ni lo compraba. Sin embargo lo pude colocar inclinando aun más el motor hacia adelante; lo malo de eso es que la cadena, en la zona del piñon, roza contra la chapa que sostiene el motor al cuadro; por lo cual tuve que bajarlo aun mas y recortar parte de la chapa, osea perdi un buen apoyo y sujecion del motor, parte estructural de esa chapa.
También, al inclinarlo, la cadena queda mas cerca del cubrecadena, por lo cual choca y raspa si no esta traccionando completamente.
Lo bueno que anda mucho mejor que el de fabrica, no pierde nafta, se ahoga muchisimo menos, y no da tirones como el generico. Encastra en la pipeta original.
Nota: paciencia, maña y unos centimetros de manguera de nafta para conectarlo.
Con manual,video ,las medias y una manguera venderían mas."
3,Bueno,anduvo joya muy buena terminacion ningun inconveniente al momento de colocarlo funciona muy bien .................................................................................................................................................................................................................................................................................................................................................................................................................................................................................................................................................................................................................................................................................................................................................................................................................................................................................................................................................................................bb
3,Mal organizados. Cosas rotas.,"Lamentablemente no mudanza no fue buena. Les advertí que había que subir las cosas por escalera a un quinto piso. Que había que subir un colchón king. Poco intento hicieron. Vino mí ex agarró a uno de los peones y le dijo vamos y así se subió el colchón. Con ayuda de un tercero pero no por ellos como debería haber sucedido. Pésima organización. Quería dejar cosas en la otra casa  porque no entraba más nada. Y que volvía al otro día por tanto me llevaba el resto. Fui a ver el camión y se terminó trayendo casi todo. Hicieron desastre con mí ropa cuando me dijo que no me preocupara. Me rompieron un almohadón del sommier. Las cajas que decían frágil no las manipularon como tal. Apilaron cosas como si nada. Me dejaron la heladera en El living. Era manipularla un milímetro más para que entre y no lo hizo. Una mala experiencia en mi caso. Y eso que rompieron no me lo paga nadie. Y ni un descuento porque el colchón, lo más jodido de la mudanza, se subió con un tercero y no con peones. Y como frutilla del postre se les escapó el gato. Nos tuvimos que mudar sin ellos.  Yo no lo recomiendo."
3,Testimonio del hombre que me dio un préstamo,"Ustedes quienes están en busca de préstamo de dinero, no sé cómo ustedes comunicar mi alegría ya que era mí incluso en busca de préstamo, he caído sobre el Sr. Christian Gabriel Ortega este hombre de negocios. Me concedió un préstamo de $ 450.000 PESOS y hablé a varioscolegas que recibieron también préstamos en el este Sr. sin tenerpreocupaciones. Especialmente mi, recibí mi demanda de crédito sin protocolo y estoy totalmente satisfecho. La razón que me impulsa a publicar este anuncio sobre Facebook y que este mujer sigue haciendo maravillas a gente que está de verdad en la necesidad. Entonces decidí comunicar esta oportunidad ustedes quienes no tienen el favor de los bancos o que habían tenido que hacer a prestamistas deshonestos que nohacen más que abusar de la personalidad de otros; tiene un proyecto o una necesidad de financiación, Necesitas Créditos personales y tu banco se niega a darte un préstamo, vives en CDI, España, URUGUAY ,MEXICO ,CHILE, USA ,PARAGUA,COSTA RICA, PANAMA, BOLIVIA, PERU,ARGENTINA, Wallis y Futuna, y la Polinesia haz como yo y envié tu solicitud para obtener tu préstamo en 3 días. Serás satisfecho, pero atención a los que no gustan reembolsar los préstamos.Puede escribirle y explicarle su situación; le ayudará si está convencido de su honradez su correo electrónico es: ayuda.para.todos111@gmail.com"
3,Jugaron con mis ilusiones,"Interesante producto, el gran problema surge porque me mandaron unos circulares y yo pedi rectangulares, y si pido rectangulares, no quiero que me manden circulares, o sea, si vos vas a comprar salamines, no queres que te den un pad circular, vos lo queres rectangular, pero si te dan un circular en vez de un rectangular, vos no quedas conforme porque vos querías comprar uno rectangular, pero te mandaron uno circular, y los circulares no tienen esquinas, entonces no es rectangular, y y o necesitaba rectangulares, pero me mandaron circulares. Asi que bueno, la próxima vez que vaya a comprar pads, voy a pedir rectangulares, esperando que sean rectangulares, por lo que voy a tener que tener ojos en la espalda, porque si no me van a dar circulares que se diferencian con los rectangulares que yo pedi. Por lo menos, cumplieron las expectativas de que eran blancos, pero el problema es que eran circulares y yo quería rectangulares.
Como este texto me quedo largo quiero resumirlo en que no estoy conforme porque me mandaron circulares en vez de rectangulares y no me quedo claro en el escrito. Pero bueno, para esto practican con las formas los nenes chicos.  
Buenas noches.
"
3,Por lo expuesto la calificación no tiene valor.,"Lamentablemente por un error exclusivamente mío, los productos recibidos no corresponden a mi auto, que es un ""nuevo"" sandero privilege 2015 con ópticas y lámparas totalmente distintas, no usa las h4 ni las w5w ámbar. Respecto a la calidad, proviniendo desde el proveedor que las vendió no tengo absolutamente ninguna observación negativa, al contrario, salvo que justamente los dos bulbos blancos recibidos completando el combo de tres productos y que asumo pueden ser utilizados en varias aplicaciones distintas en mi auto, no vinieron en un blister como los de color ámbar ni son de las mismas características de fabricación ni terminación, sino que llegaron sueltos y sin visibilizarse en forma inequívoca, (al menos para mí), que son de la misma marca y calidad que los anteriores. La próxima vez tendré que tener más cuidado en verificar la exactitud en mis pedidos. Al margen de esto muchas gracias por su interés y no duden que seguiré comprando a través de ustedes y si se diera el caso, también al mismo vendedor. Los saluda muy atentamente, joaquín carlos medel."
3,Bueno,Lindos Lindos Lindos Lindos Lindos Lindos Lindos Lindos Lindos Lindos Lindos Lindos Lindos Lindos Lindos Lindos Lindos Lindos Lindos Lindos Lindos Lindos Lindos Lindos Lindos Lindos Lindos Lindos Lindos Lindos Lindos Lindos Lindos Lindos Lindos Lindos Lindos Lindos Lindos Lindos Lindos Lindos Lindos Lindos Lindos Lindos Lindos Lindos Lindos Lindos Lindos Lindos Lindos Lindos Lindos Lindos Lindos Lindos Lindos Lindos Lindos Lindos Lindos Lindos Lindos Lindos Lindos Lindos Lindos Lindos Lindos Lindos Lindos Lindos Lindos Lindos Lindos Lindos Lindos Lindos Lindos Lindos Lindos Lindos Lindos Lindos Lindos Lindos Lindos Lindos Lindos Lindos Lindos Lindos Lindos Lindos Lindos Lindos Lindos Lindos Lindos Lindos Lindos Lindos Lindos Lindos Lindos Lindos Lindos Lindos Lindos Lindos Lindos Lindos Lindos Lindos Lindos Lindos Lindos Lindos Lindos Lindos Lindos Lindos Lindos Lindos Lindos Lindos Lindos Lindos Lindos Lindos Lindos Lindos Lindos Lindos Lindos Lindos Lindos Lindos Lindos Lindos Lindos Lindos Lindos Lindos Lindos Lindos Lindos Lindos Lindos Lindos Lindos Lindos Lindos Lindos Lindos Lindos Lindos Lindos Lindos Lindos Lindos Lindos Lindos Lindos Lindos Lindos Lindos Lindos Lindos Lindos Lindos Lindos Lindos Lindos Lindos Lindos Lindos Lindos Lindos Lindos Lindos Lindos Lindos Lindos Lindos Lindos Lindos Lindos Lindos Lindos Lindos Lindos Lindos Lindos Lindos Lindos Lindos Lindos Lindos Lindos Lindos Lindos Lindos Lindos Lindos Lindos Lindos Lindos Lindos Lindos Lindos Lindos Li
3,"Buen producto, excelente si le ponés un SSD","Es un buen producto, para uso hogareño, está bien. Como contra remarco Win10 (se apaga cuando quiere, y no cuando lo necesito); el disco rígido es más lento Biglia, al punto de disimular que viene con un I7 de séptima generación!!! Por las características esperaba un mejor rendimiento. De cualquier manera, una vez que se han cargado las aplicaciones, la cosa fluye. Tampoco me gustó que las teclas de función se activen por defecto con la tecla Fn (es configurable). El plástico es lindo, es buena la terminación, pero claramente de gama media. El teclado es aceptable. Vengo de una lenovo T410 (snif!) y el trackpad no me resultó muy agradable. Ya que viene sin cd, podrían haber incorporado un cady en lugar de dejar el plástico cobertor. Que venga con dos USB de enchufe viejo es una contra (es poco), dado que no tengo nada con USB-C y tengo el puerto de sobra; en un futuro seguro que resultará escaso.   La pantalla es buena, me resultó agradable con lindos colores y muy buen brillo. El angulo de visión es aceptable. Su peso y dimensiones están equilibrados a mi gusto. El diseño me resultó agradable. En líneas generales está buena, es recomendable.    Comprala tranquilo sI lo que te ajusta es el presupuesto; de última conseguite unos pesos más y ponele un disco de estado sólido, porque con el de que viene te subís a una tortuga (hace unos años que vengo usando SSD en otras compus)"
3,"Acorde al precio, no es un linksys","No tan bueno, una de las primeras cosas por lo que lo compre fue por estar cansado de las transferencias lentas en la red local, de pc a pc, de pc a smartphone, etc. A pesar de tener todas las antenas que tiene no es rompemuros en 2.4g, el modem wifi de la empresa me va mas rapido, en la noche alcanzo el megabit por segundo o mas de 1mB/s. Si lo compraste por ser 5gigahertz, a no ser que lo uses con un adaptador usb de la misma marca no vas a lograr los 100mbps de velocidad intranet para por ejemplo ver una pelicula hd mkv ubicada en un servidor central o para transferir esa pelicula o un programa a tu celular, LOS CELULARES DUAL BAND NO SON AC, son a, b, g, n, mixed incluso al operar en la banda de 5gigas, solo un iphone o los de alta gama tienen dualband ac, la norma ac 802.11 es la que da la velocidad de entre 400 a 867mbps. El soporte de tp link argentina deja mucho que desear, el problema termine resolviendolo yo mismo. Si usas este router con cualquier cosa que no sea ac te va a andar igual de lento que antes, en una ciudad densamente contaminada por RF todos los routers wifi son lentos."
3,Bueno,"La casa cucha esta realizado en madera rustica, la cual hace que se rompa la madera cuando se colocan los tornillos, la terminacion es rustica no esta bien barnizada, tube que pasar una mano de barniz el cual incrementa el costo de la casa, la madera debajo de las chapas las cuales estan expuestas en los laterales sin el barniz, madera virgen, en sintensis se uso madera no de buena calidad, grietas, maderas dobladas, quedan gritas internas y el barniz se ahorraron mucho habia que pasarle otra mano, la apariencia es muy buena el armado muy simple, ya que lo pedi desarmado, no trae manual indicaciones y tampoco vienen perforadas para su armado y desarmado como indica el vendedor.
Pero es un producto bueno, no lo que me esperaba por el precio y lo descripto que indicaba que estaban realizadas en maderas de 2 pulgadas, maderas de  pino de facil agrietacion , ojala le dure ya que el perro que tengo es un dogo argentino de gran porte, 
Este comentario respecto al producto no tiene un fin que no es otro que las proximas casas cuchas le pongan enfasis o sea en un comentario constructivo.
Espero que asi lo considere el vendedor, dado que fue muy amable en su atencion, el cual se lo agradezco."
3,Base y palanca frágil. No apta para envío x correo,"Compré pava eléctrica Everest a Carlos Pereira de AREASHOP.NET. Llegó con base y palanca plástica rotas, se ven frágiles y además la caja de la pava no trae ninguna protección interna. El vendedor tampoco la embaló con alguna protección. La devolví por Correo porque el vendedor dijo que la cambiaría. Incluso la devolví con una caja reforzada y con protecciones internas para que me manden la nueva pava en esa caja. Pero luego el vendedor me mandó la misma pava con rotura. Nuevamente tenía que volver al correo a devolverla y esperar a que MercadoLibre me devuelva el costo de envío y esperar a que la tarjeta de crédito me devuelva la cuota ya pagada en el próximo resumen de la tarjeta. Por eso decidí pedirle un descuento al vendedor y finalmente me la quedé. Por ahora funciona bien, pero me arriesgo a que la garantía no me cubra un eventual desperfecto, debido a la rotura en la base plástica. CONCLUSIÓN: conviene retirarla personalmente y cuidar que no se golpee la base y la palanca plástica porque son frágiles."
3,Muy bueno,"El producto está bien si necesitas 1 o 2, despues por precio te conviene un dvr con camaras cableadas. 
. 
En estas camaras la unica forma de bajar las grabaciones son:. 
Buscar con el celu o tablet en las grabaciones (con pc solo podes ver en vivo) y despues cuando encontras los que queres bajar lo vas grabando y lo descargas a ese dispositivo de ahi los podes compratir. 
. 
La otra forma es sacar la micro sd y ponerla en un adaptador usb y bajarlas a una pc. 
Este punto es medio flojito porque a veces no da para andar sacando la tarjeta de la camara. 
. 
El audio lo capta bastante bien y graba con sonido eso es bueno. 
La imagen es correcta pero podría ser mejor. 
El angulo de apertura horizontal esta buenisimo (113 grados). 
La instalacion del software en android es super facil casi automatica. 
Tenes que tener en cuenta que ademas tenes que entrar en la ip de la camara con el browser y tenes otras configuraciones avanzadas. 
. 
Si no tenes buena conexion la visualizacion remota puede ser defectuosa. 
. 
En lineas generales por ser una camara domestica está bien, le faltaria mejorar la imagen, tener una mejor gestion de las grabaciones y poder bajar la calidad de la vision remota para adaptarla a malos servicios de internet (que son el 80% en argentina, ademas de carisimos)."
3,"Buenos, pro y contras","Muy buen balance de sonido, super definidos y claros, Agudos conservados, no excsivos
Para el que busca graves profundos que piense en otros auriculares, los graves de este equipo son justos.

La comodidad es su punto fuerte, fuertisimo!!! Las almohadillas sun de un simil piel muy suave y con goma muy blanda, super comodos, la oreja entra completamente dentro de los auriculares sin tocar en ningun lado, en el interior de los mismos el parlante esta inclinado para que la parte trasera de la oreja (la mas separada de la cabeza) no toque nada.
El estuche es muy copado pero muuuuy grande, es excesivo el tamaño y no es practico a la hora de llevarlo en la mochila 

Punto en contra: 
El largo del cable, es de 1,7 metros por lo que para usar en la calle es muy incomodo
La construccion es buena pero no excelente, el material plastico esta bien pero no sobresale por la calidad, en este sentido no parecen auriculares pro
Son muuuuy caros, $4000 es excesivo por un equipo asi, he probado unos philips de $500 y sacando la comodidad se le aproximan mucho en calidad de sonido
 

"
3,Bueno,Esta buena...............................................................................................................................................................................................................................................................................................................................................................................................................................................................................................................................................................................................................................................................................................................................................................................................................................................................................................................................................................................................................................................................................................................................................................................................................................................................................................................................................................................................................................................................................................................................................!!!
